{
  "format": "wall-parts",
  "version": 1,
  "id": "new-area-wall",
  "themes": [
    "new-area"
  ],
  "image": "atlas-32.png",
  "tileSize": 32,
  "rise": 0.5,
  "width": 128,
  "height": 144,
  "parts": {
    "cap": [
      [
        0,
        0,
        32,
        48
      ],
      [
        32,
        0,
        32,
        48
      ]
    ],
    "front": [
      [
        64,
        0,
        32,
        48
      ],
      [
        96,
        0,
        32,
        48
      ]
    ],
    "leftStart": [
      [
        0,
        48,
        32,
        48
      ]
    ],
    "leftMiddle": [
      [
        32,
        48,
        32,
        48
      ]
    ],
    "leftEnd": [
      [
        64,
        48,
        32,
        48
      ]
    ],
    "leftSingle": [
      [
        96,
        48,
        32,
        48
      ]
    ],
    "rightStart": [
      [
        0,
        96,
        32,
        48
      ]
    ],
    "rightMiddle": [
      [
        32,
        96,
        32,
        48
      ]
    ],
    "rightEnd": [
      [
        64,
        96,
        32,
        48
      ]
    ],
    "rightSingle": [
      [
        96,
        96,
        32,
        48
      ]
    ]
  }
}
